{
  "barrierRevision": 2,
  "cohortKey": "bbbbbbbbbbbbbbbbbbbbbbbbbbbbbbbbbbbbbbbbbbbbbbbbbbbbbbbbbbbbbbbb",
  "holdRevision": 0,
  "installReceiptDigest": "aaaaaaaaaaaaaaaaaaaaaaaaaaaaaaaaaaaaaaaaaaaaaaaaaaaaaaaaaaaaaaaa",
  "kind": "PreparePurge",
  "planDigest": "cccccccccccccccccccccccccccccccccccccccccccccccccccccccccccccccc",
  "pluginId": "go-orca",
  "schemaVersion": 1,
  "transactionId": "tx-purge-1",
  "writer": "Host"
}
