{
  "cohortKey": "bbbbbbbbbbbbbbbbbbbbbbbbbbbbbbbbbbbbbbbbbbbbbbbbbbbbbbbbbbbbbbbb",
  "deadlineUnixMs": 1754193600000,
  "epochCandidate": 1,
  "installReceiptDigest": "aaaaaaaaaaaaaaaaaaaaaaaaaaaaaaaaaaaaaaaaaaaaaaaaaaaaaaaaaaaaaaaa",
  "kind": "ProvisionRequest",
  "pluginId": "go-orca",
  "provisionNonce": "00000000000000000000000000000000",
  "requestDigest": "cccccccccccccccccccccccccccccccccccccccccccccccccccccccccccccccc",
  "schemaVersion": 1
}
